{
  "creatureStatistics": {
    "name": "Teller",
    "health": 50,
    "maxHealth": 50,
    "attack": 1,
    "mana": 0,
    "maxMana": 0,
    "attackSlowness": 40,
    "defense": 5,
    "slowness": 20,
    "outfit": {
      "id": 141,
      "details": {
        "head": 12,
        "body": 2,
        "legs": 12,
        "feet": 10
      }
    }
  },
  "hearingRange": 5,
  "wanderRange": 2,
  "farewells": [
    "bye"
  ],
  "greetings": [
    "hello",
    "hi"
  ],
  "sayings": {
    "texts": [
      "A safe place to store your items!"
    ],
    "slowness": 300,
    "chance": 0.75
  },
  "script": "teller.js"
}